{
  "version": "1.0.0",
  "last_updated": "2026-02-16",
  "nodes": [
    {
      "id": "path_tracing",
      "type": "category",
      "label": "Path Tracing",
      "description": "Unbiased global illumination via stochastic light-path sampling."
    },
    {
      "id": "ray_tracing",
      "type": "category",
      "label": "Ray Tracing",
      "description": "Image synthesis by tracing rays from the camera into the scene."
    },
    {
      "id": "rasterization",
      "type": "category",
      "label": "Rasterization",
      "description": "Real-time rendering by projecting primitives onto a 2-D pixel grid."
    },
    {
      "id": "neural",
      "type": "category",
      "label": "Neural Rendering",
      "description": "Rendering techniques that use neural networks to represent or synthesize images."
    },
    {
      "id": "gaussian_splatting",
      "type": "category",
      "label": "Gaussian Splatting",
      "description": "Rendering by projecting and alpha-compositing 3-D Gaussian primitives."
    },
    {
      "id": "differentiable",
      "type": "category",
      "label": "Differentiable Rendering",
      "description": "Renderers whose output is differentiable with respect to scene parameters."
    },
    {
      "id": "volume_rendering",
      "type": "category",
      "label": "Volume Rendering",
      "description": "Direct visualization of 3-D scalar or vector fields without surface extraction."
    },
    {
      "id": "educational",
      "type": "category",
      "label": "Educational",
      "description": "Minimal or tutorial-oriented renderers designed primarily for learning."
    },
    {
      "id": "node-3d-gaussian-splatting",
      "type": "renderer",
      "label": "3D Gaussian Splatting",
      "renderer_id": "3d-gaussian-splatting"
    },
    {
      "id": "node-3d-slicer",
      "type": "renderer",
      "label": "3D Slicer",
      "renderer_id": "3d-slicer"
    },
    {
      "id": "node-3dgs-cpp",
      "type": "renderer",
      "label": "3DGS.cpp",
      "renderer_id": "3dgs-cpp"
    },
    {
      "id": "node-appleseed",
      "type": "renderer",
      "label": "appleseed",
      "renderer_id": "appleseed"
    },
    {
      "id": "node-babylonjs",
      "type": "renderer",
      "label": "Babylon.js",
      "renderer_id": "babylonjs"
    },
    {
      "id": "node-bevy",
      "type": "renderer",
      "label": "Bevy",
      "renderer_id": "bevy"
    },
    {
      "id": "node-bgfx",
      "type": "renderer",
      "label": "bgfx",
      "renderer_id": "bgfx"
    },
    {
      "id": "node-blender-cycles",
      "type": "renderer",
      "label": "Blender Cycles",
      "renderer_id": "blender-cycles"
    },
    {
      "id": "node-blender-eevee",
      "type": "renderer",
      "label": "Blender EEVEE",
      "renderer_id": "blender-eevee"
    },
    {
      "id": "node-deodr",
      "type": "renderer",
      "label": "DEODR",
      "renderer_id": "deodr"
    },
    {
      "id": "node-drjit",
      "type": "renderer",
      "label": "Dr.Jit",
      "renderer_id": "drjit"
    },
    {
      "id": "node-embree",
      "type": "renderer",
      "label": "Intel Embree",
      "renderer_id": "embree"
    },
    {
      "id": "node-filament",
      "type": "renderer",
      "label": "Google Filament",
      "renderer_id": "filament"
    },
    {
      "id": "node-gaussian-splatting-lightning",
      "type": "renderer",
      "label": "gaussian-splatting-lightning",
      "renderer_id": "gaussian-splatting-lightning"
    },
    {
      "id": "node-godot",
      "type": "renderer",
      "label": "Godot Engine",
      "renderer_id": "godot"
    },
    {
      "id": "node-gsplat",
      "type": "renderer",
      "label": "gsplat",
      "renderer_id": "gsplat"
    },
    {
      "id": "node-indigo-renderer",
      "type": "renderer",
      "label": "Indigo Renderer",
      "renderer_id": "indigo-renderer"
    },
    {
      "id": "node-instant-ngp",
      "type": "renderer",
      "label": "Instant-NGP",
      "renderer_id": "instant-ngp"
    },
    {
      "id": "node-lichtfeld-studio",
      "type": "renderer",
      "label": "LichtFeld Studio",
      "renderer_id": "lichtfeld-studio"
    },
    {
      "id": "node-luxcorerender",
      "type": "renderer",
      "label": "LuxCoreRender",
      "renderer_id": "luxcorerender"
    },
    {
      "id": "node-mitsuba3",
      "type": "renderer",
      "label": "Mitsuba 3",
      "renderer_id": "mitsuba3"
    },
    {
      "id": "node-nerfacc",
      "type": "renderer",
      "label": "Nerfacc",
      "renderer_id": "nerfacc"
    },
    {
      "id": "node-nerfstudio",
      "type": "renderer",
      "label": "Nerfstudio",
      "renderer_id": "nerfstudio"
    },
    {
      "id": "node-nvdiffrast",
      "type": "renderer",
      "label": "nvdiffrast",
      "renderer_id": "nvdiffrast"
    },
    {
      "id": "node-nvidia-falcor",
      "type": "renderer",
      "label": "NVIDIA Falcor",
      "renderer_id": "nvidia-falcor"
    },
    {
      "id": "node-nvidia-kaolin",
      "type": "renderer",
      "label": "NVIDIA Kaolin",
      "renderer_id": "nvidia-kaolin"
    },
    {
      "id": "node-ogre3d",
      "type": "renderer",
      "label": "Ogre3D / OgreNext",
      "renderer_id": "ogre3d"
    },
    {
      "id": "node-open3d",
      "type": "renderer",
      "label": "Open3D",
      "renderer_id": "open3d"
    },
    {
      "id": "node-ospray",
      "type": "renderer",
      "label": "Intel OSPRay",
      "renderer_id": "ospray"
    },
    {
      "id": "node-panda3d",
      "type": "renderer",
      "label": "Panda3D",
      "renderer_id": "panda3d"
    },
    {
      "id": "node-paraview",
      "type": "renderer",
      "label": "ParaView",
      "renderer_id": "paraview"
    },
    {
      "id": "node-pbrt",
      "type": "renderer",
      "label": "PBRT v4",
      "renderer_id": "pbrt"
    },
    {
      "id": "node-povray",
      "type": "renderer",
      "label": "POV-Ray",
      "renderer_id": "povray"
    },
    {
      "id": "node-pytorch3d",
      "type": "renderer",
      "label": "PyTorch3D",
      "renderer_id": "pytorch3d"
    },
    {
      "id": "node-radeon-prorender",
      "type": "renderer",
      "label": "Radeon ProRender",
      "renderer_id": "radeon-prorender"
    },
    {
      "id": "node-raylib",
      "type": "renderer",
      "label": "raylib",
      "renderer_id": "raylib"
    },
    {
      "id": "node-raytracing-in-one-weekend",
      "type": "renderer",
      "label": "Ray Tracing in One Weekend",
      "renderer_id": "raytracing-in-one-weekend"
    },
    {
      "id": "node-redner",
      "type": "renderer",
      "label": "redner",
      "renderer_id": "redner"
    },
    {
      "id": "node-smallpt",
      "type": "renderer",
      "label": "smallpt",
      "renderer_id": "smallpt"
    },
    {
      "id": "node-softrasterizer",
      "type": "renderer",
      "label": "SoftRasterizer",
      "renderer_id": "softrasterizer"
    },
    {
      "id": "node-sokol",
      "type": "renderer",
      "label": "Sokol",
      "renderer_id": "sokol"
    },
    {
      "id": "node-sort",
      "type": "renderer",
      "label": "SORT",
      "renderer_id": "sort"
    },
    {
      "id": "node-taichi",
      "type": "renderer",
      "label": "Taichi",
      "renderer_id": "taichi"
    },
    {
      "id": "node-tensorflow-graphics",
      "type": "renderer",
      "label": "TensorFlow Graphics",
      "renderer_id": "tensorflow-graphics"
    },
    {
      "id": "node-the-forge",
      "type": "renderer",
      "label": "The Forge",
      "renderer_id": "the-forge"
    },
    {
      "id": "node-threejs",
      "type": "renderer",
      "label": "three.js",
      "renderer_id": "threejs"
    },
    {
      "id": "node-tinyraytracer",
      "type": "renderer",
      "label": "tinyraytracer",
      "renderer_id": "tinyraytracer"
    },
    {
      "id": "node-tungsten",
      "type": "renderer",
      "label": "Tungsten",
      "renderer_id": "tungsten"
    },
    {
      "id": "node-viskores",
      "type": "renderer",
      "label": "Viskores (VTK-m)",
      "renderer_id": "viskores"
    },
    {
      "id": "node-voreen",
      "type": "renderer",
      "label": "Voreen",
      "renderer_id": "voreen"
    },
    {
      "id": "node-vtk",
      "type": "renderer",
      "label": "VTK",
      "renderer_id": "vtk"
    },
    {
      "id": "node-wicked-engine",
      "type": "renderer",
      "label": "Wicked Engine",
      "renderer_id": "wicked-engine"
    },
    {
      "id": "node-yafray",
      "type": "renderer",
      "label": "YafaRay",
      "renderer_id": "yafray"
    }
  ],
  "edges": [
    {
      "source": "node-3d-gaussian-splatting",
      "target": "neural",
      "type": "belongs_to",
      "label": null
    },
    {
      "source": "node-3d-slicer",
      "target": "volume_rendering",
      "type": "belongs_to",
      "label": null
    },
    {
      "source": "node-3dgs-cpp",
      "target": "gaussian_splatting",
      "type": "belongs_to",
      "label": null
    },
    {
      "source": "node-appleseed",
      "target": "path_tracing",
      "type": "belongs_to",
      "label": null
    },
    {
      "source": "node-babylonjs",
      "target": "rasterization",
      "type": "belongs_to",
      "label": null
    },
    {
      "source": "node-bevy",
      "target": "rasterization",
      "type": "belongs_to",
      "label": null
    },
    {
      "source": "node-bgfx",
      "target": "rasterization",
      "type": "belongs_to",
      "label": null
    },
    {
      "source": "node-blender-cycles",
      "target": "path_tracing",
      "type": "belongs_to",
      "label": null
    },
    {
      "source": "node-blender-eevee",
      "target": "rasterization",
      "type": "belongs_to",
      "label": null
    },
    {
      "source": "node-deodr",
      "target": "differentiable",
      "type": "belongs_to",
      "label": null
    },
    {